{
  "tournament": "Copa Libertadores",
  "season": "2026",
  "render": { "box_width": 240 },
  "rounds": [
    {
      "name": "Quarterfinals",
      "matches": [
        {
          "id": "qf1",
          "legs": [{ "ref": 84021 }, { "ref": 84022 }],
          "winner": 1
        },
        {
          "id": "qf2",
          "legs": [
            { "team1": "River Plate", "goals1": 1, "team2": "Palmeiras", "goals2": 1 },
            {
              "team1": "Palmeiras",
              "goals1": 0,
              "pen1": 2,
              "team2": "River Plate",
              "goals2": 0,
              "pen2": 4
            }
          ],
          "winner": 1
        },
        {
          "id": "qf3",
          "legs": [
            {
              "team1": "Montevideo City Torque",
              "goals1": 1,
              "team2": "Atletico Mineiro",
              "goals2": 0
            },
            {
              "team1": "Atletico Mineiro",
              "goals1": 1,
              "team2": "Montevideo City Torque",
              "goals2": 1
            }
          ],
          "winner": 1
        },
        {
          "id": "qf4",
          "legs": [
            { "team1": "Corinthians", "goals1": 3, "team2": "Internacional", "goals2": 0 },
            { "team1": "Internacional", "goals1": 1, "team2": "Corinthians", "goals2": 1 }
          ],
          "winner": 1
        }
      ]
    },
    {
      "name": "Semifinals",
      "matches": [
        {
          "id": "sf1",
          "winnerof1": "qf1",
          "winnerof2": "qf2",
          "legs": [
            { "team1": "Flamengo", "goals1": 0, "team2": "River Plate", "goals2": 0 },
            { "team1": "River Plate", "goals1": 1, "team2": "Flamengo", "goals2": 2 }
          ],
          "winner": 1
        },
        {
          "id": "sf2",
          "winnerof1": "qf3",
          "winnerof2": "qf4",
          "legs": [
            {
              "team1": "Montevideo City Torque",
              "goals1": 1,
              "team2": "Corinthians",
              "goals2": 1
            },
            {
              "team1": "Corinthians",
              "goals1": 0,
              "team2": "Montevideo City Torque",
              "goals2": 2
            }
          ],
          "winner": 1
        }
      ]
    },
    {
      "name": "Final",
      "matches": [
        {
          "id": "final",
          "winnerof1": "sf1",
          "winnerof2": "sf2",
          "team1": "Flamengo",
          "team2": "Montevideo City Torque"
        }
      ]
    }
  ]
}
